{"schema_version":"1.0.0","producer_namespace":"acme/records","producer_ref":"records-team","application_id":"A-001","policy_fingerprint":"sha256:cccccccccccccccccccccccccccccccccccccccccccccccccccccccccccccccc","artifacts":[{"kind":"receipt","fingerprint":"sha256:aaaaaaaaaaaaaaaaaaaaaaaaaaaaaaaaaaaaaaaaaaaaaaaaaaaaaaaaaaaaaaaa"}],"operation":"preservation","outcome":"completed","custodian_ref":"store-1","method_ref":"method/opaque-001","observed_at":"2026-09-24T10:04:00Z"}
